<!ELEMENT knjiznica (knjiga+)>
<!ELEMENT knjiga (naslov, autor, godina)>
<!ELEMENT naslov (#PCDATA)>
<!ELEMENT autor (#PCDATA)>
<!ELEMENT godina (#PCDATA)>

<!ATTLIST knjiga
  id ID #REQUIRED>
